title,link
"Xe ga 125cc giá 40 triệu đồng đẹp long lanh, trang bị xịn chẳng kém SH Mode, rẻ chỉ như Vision",https://baomoi.com/xe-ga-125cc-gia-40-trieu-dong-dep-long-lanh-trang-bi-xin-chang-kem-sh-mode-re-chi-nhu-vision-c54660159.epi
"Giá xăng tăng trong đêm, xăng RON 95 -III lên 29.120 đồng/lít",https://baomoi.com/gia-xang-tang-trong-dem-xang-ron-95-iii-len-29-120-dong-lit-c54660320.epi
"Chi mạnh Quỹ bình ổn, Giá xăng RON 95 vẫn tăng vượt 29.000 đồng/lít",https://baomoi.com/chi-manh-quy-binh-on-gia-xang-ron-95-van-tang-vuot-29-000-dong-lit-c54660088.epi
"Chi Quỹ bình ổn sau hơn 3 năm, giá dầu giảm 2.706 đồng/lít",https://baomoi.com/chi-quy-binh-on-sau-hon-3-nam-gia-dau-giam-2-706-dong-lit-c54660208.epi
Hàng hóa rục rịch tăng theo giá cước vận chuyển,https://baomoi.com/hang-hoa-ruc-rich-tang-theo-gia-cuoc-van-chuyen-c54660069.epi
Nỗ lực giữ giá hàng hóa,https://baomoi.com/no-luc-giu-gia-hang-hoa-c54660391.epi
Khi nào cây xăng được phép 'đóng cửa'?,https://baomoi.com/khi-nao-cay-xang-duoc-phep-dong-cua-c54660086.epi
"Cao Bằng tăng cường kiểm tra, giám sát hoạt động kinh doanh xăng dầu",https://baomoi.com/cao-bang-tang-cuong-kiem-tra-giam-sat-hoat-dong-kinh-doanh-xang-dau-c54660009.epi
Điện mặt trời có giúp giảm rủi ro trước biến động giá năng lượng?,https://baomoi.com/dien-mat-troi-co-giup-giam-rui-ro-truoc-bien-dong-gia-nang-luong-c54660002.epi
"Xăng tăng giá liên tục, người Hà Nội bỏ xe cá nhân, ùn ùn đi tàu điện",https://baomoi.com/xang-tang-gia-lien-tuc-nguoi-ha-noi-bo-xe-ca-nhan-un-un-di-tau-dien-c54660335.epi
"Chi Quỹ Bình ổn, giá dầu hỏa giảm hơn 2.700 đồng/lít",https://baomoi.com/chi-quy-binh-on-gia-dau-hoa-giam-hon-2-700-dong-lit-c54660075.epi
Nhiều giải pháp bình ổn giá xăng dầu,https://baomoi.com/nhieu-giai-phap-binh-on-gia-xang-dau-c54660214.epi
Kho dự trữ dầu chiến lược trở thành 'lá chắn' trước cú sốc năng lượng toàn cầu,https://baomoi.com/kho-du-tru-dau-chien-luoc-tro-thanh-la-chan-truoc-cu-soc-nang-luong-toan-cau-c54660235.epi
"Santa Fe, CX-8 và Outlander: 7 chỗ nào thật sự dùng được?",https://baomoi.com/santa-fe-cx-8-va-outlander-7-cho-nao-that-su-dung-duoc-c54659976.epi
